{
  "$schema": "https://json-schema.org/draft/2020-12/schema",
  "title": "Top-level pages",
  "description": "Every top-level page under site/, in nav menu order. Posts are found automatically and do not go here. {name} is filled in from data/site.json.",
  "type": "array",
  "items": {
    "type": "object",
    "required": [
      "file",
      "title",
      "description",
      "og_type",
      "sitemap",
      "nav"
    ],
    "additionalProperties": false,
    "properties": {
      "file": {
        "type": "string",
        "pattern": "^[a-z0-9-]+\\.html$"
      },
      "title": {
        "type": "string"
      },
      "description": {
        "type": "string"
      },
      "og_type": {
        "enum": [
          "website",
          "article"
        ]
      },
      "sitemap": {
        "description": "Lists the page in site/sitemap.xml.",
        "type": "boolean"
      },
      "nav": {
        "description": "Stamps the shared nav into the page.",
        "type": "boolean"
      },
      "menu": {
        "description": "Shows a link to the page in the site nav.",
        "type": "object",
        "required": [
          "label",
          "new_tab"
        ],
        "additionalProperties": false,
        "properties": {
          "label": {
            "type": "string"
          },
          "new_tab": {
            "type": "boolean"
          }
        }
      },
      "noindex": {
        "description": "Adds a noindex tag, so search engines skip the page.",
        "type": "boolean"
      },
      "pdf": {
        "description": "Names a PDF that scripts/render_pdf.py prints from this page when the site publishes. The page links to it. It is never committed.",
        "type": "string",
        "pattern": "^[a-z0-9-]+\\.pdf$"
      },
      "pdf_max_pages": {
        "description": "The most pages the printed PDF may have, as a whole number. tests/test_resume_pdf_matches_record.py fails when the PDF is longer.",
        "type": "number"
      },
      "absolute": {
        "description": "Writes root-relative links (/styles/site.css) in the nav and footer, for a page served at any depth, such as 404.html.",
        "type": "boolean"
      }
    }
  }
}
